{
  "$schema": "./budget.schema.json",
  "description": "Vanilla Breeze performance budget. Targets A+ carbon rating (~270KB transfer for a typical page).",
  "version": "1.0.0",
  "targets": {
    "carbon_a_plus_kb": 270,
    "carbon_a_kb": 531
  },
  "framework": {
    "description": "Framework core — tokens, reset, native-elements, custom-elements registry",
    "css_kb": 15,
    "js_kb": 10,
    "note": "Minified and gzipped. Excludes individual component files."
  },
  "per_component": {
    "description": "Budget per individual component (CSS + JS combined)",
    "max_kb": 10,
    "warn_kb": 7,
    "note": "Components are loaded on demand, not as a bundle."
  },
  "fonts": {
    "description": "Web font budget per page",
    "max_kb": 60,
    "warn_kb": 40,
    "note": "Use variable fonts and Latin subset where possible."
  },
  "images": {
    "description": "Total image budget per page (excludes hero/editorial images)",
    "max_kb": 100,
    "warn_kb": 75,
    "note": "Use modern formats (WebP, AVIF). Hero images assessed separately."
  },
  "theme": {
    "description": "Per theme bundle including fonts declared by theme",
    "max_kb": 50,
    "warn_kb": 35
  },
  "demo_site": {
    "description": "Full demo page target (framework + 3 components + 1 theme + content)",
    "max_kb": 270,
    "warn_kb": 200,
    "note": "This is the A+ carbon rating target."
  }
}
